,examine,id,members,lowalch,limit,value,highalch,icon,name
933,Pour this on compost to turn it into super-compost.,6474,True,24.0,50.0,60,36.0,Compost potion(2).png,Compost potion(2)
934,Pour this on compost to turn it into super-compost.,6472,True,36.0,50.0,90,54.0,Compost potion(3).png,Compost potion(3)
935,Pour this on compost to turn it into super-compost.,6470,True,48.0,50.0,120,72.0,Compost potion(4).png,Compost potion(4)
936,Mmm this looks tasty.,2140,False,1.0,6000.0,4,2.0,Cooked chicken.png,Cooked chicken
937,It might look delicious to an ogre.,2878,True,52.0,6000.0,130,78.0,Cooked chompy.png,Cooked chompy
938,Roasted chompy bird.,7228,True,34.0,100.0,85,51.0,Cooked chompy (roasted).png,Cooked chompy (roasted)
939,Nice and tasty!,7521,True,20.0,6000.0,50,30.0,Cooked crab meat 5.png,Cooked crab meat
940,Lovely Jubbly!,7568,True,60.0,10000.0,150,90.0,Cooked jubbly.png,Cooked jubbly
941,Cooked octopus. It looks very nutritious.,3144,True,100.0,10000.0,250,150.0,Cooked karambwan.png,Cooked karambwan
942,Mmm this looks tasty.,2142,False,1.0,6000.0,4,2.0,Cooked meat.png,Cooked meat
943,I don't want to think about what kind of meat it is.,24785,True,1.0,,1,1.0,Cooked mystery meat.png,Cooked mystery meat
944,Deliciously cooked oomlie meat in a palm leaf pouch.,2343,True,14.0,15.0,35,21.0,Cooked oomlie wrap.png,Cooked oomlie wrap
945,Mmm this looks tasty.,3228,True,1.0,6000.0,4,2.0,Cooked rabbit.png,Cooked rabbit
946,"A cooked slimy eel - not delicious, but pretty nutritious.",3381,True,1.0,6000.0,1,1.0,Cooked slimy eel.png,Cooked slimy eel
947,Delicious cooked sweetcorn.,5988,True,3.0,11000.0,9,5.0,Cooked sweetcorn.png,Cooked sweetcorn
948,Keeps the doctor away.,1955,False,1.0,13000.0,1,1.0,Cooking apple.png,Cooking apple
949,This needs refining.,436,False,1.0,13000.0,3,1.0,Copper ore.png,Copper ore
950,It's cornflour.,7466,False,1.0,15.0,1,1.0,Cornflour.png,Cornflour
951,Used for enchant spells.,564,False,20.0,12000.0,50,30.0,Cosmic rune.png,Cosmic rune
952,A mysterious power emanates from the talisman...,1454,True,1.0,11000.0,4,2.0,Cosmic talisman.png,Cosmic talisman
953,A tiara infused with the properties of the cosmos.,5539,True,40.0,40.0,100,60.0,Cosmic tiara.png,Cosmic tiara
954,I should take this to the tannery.,1739,False,1.0,13000.0,2,1.0,Cowhide.png,Cowhide
955,This bow once belonged to a formidable follower of Armadyl.,22547,True,48000.0,8.0,120000,72000.0,Craw's bow (u).png,Craw's bow (u)
956,"They're soft, silky and cream.",632,True,80.0,150.0,200,120.0,Cream boots.png,Cream boots
957,A silly cream pointed hat.,662,True,64.0,150.0,160,96.0,Cream hat.png,Cream hat
958,Made by Tree Gnomes with a thing for cream.,652,True,72.0,150.0,180,108.0,Cream robe bottoms.png,Cream robe bottoms
959,"The ultimate in gnome design, now in cream!",642,True,72.0,150.0,180,108.0,Cream robe top.png,Cream robe top
960,For whom?,20243,True,2000.0,4.0,5000,3000.0,Crier bell.png,Crier bell
961,Don't shoot the messenger!,20240,True,2000.0,4.0,5000,3000.0,Crier coat.png,Crier coat
962,Hear ye! Hear ye!,12319,True,2000.0,4.0,5000,3000.0,Crier hat.png,Crier hat
963,This fires crossbow bolts.,837,False,28.0,125.0,70,42.0,Crossbow.png,Crossbow
964,A string for a crossbow.,9438,True,1.0,11000.0,1,1.0,Crossbow string.png,Crossbow string
965,How does it all fit in there?,8496,True,4.0,500.0,10,6.0,Crude chair (flatpack).png,Crude chair (flatpack)
966,A shallow tray used for baking crunchies in.,2165,True,4.0,40.0,10,6.0,Crunchy tray.png,Crunchy tray
967,A crushed bird's nest.,6693,True,80.0,11000.0,200,120.0,Crushed nest.png,Crushed nest
968,Ground up superior dragon bones.,21975,True,20.0,11000.0,50,30.0,Crushed superior dragon bones.png,Crushed superior dragon bones
969,A seed to be sung into the finest crystal armour.,23956,True,200000.0,,500000,300000.0,Crystal armour seed.png,Crystal armour seed
970,How does it all fit in there?,8624,True,4.0,500.0,10,6.0,Crystal ball (flatpack).png,Crystal ball (flatpack)
971,Smells of victory.,24000,True,12000.0,,30000,18000.0,Crystal grail.png,Crystal grail
972,A mysterious key for a mysterious chest.,989,True,60.0,11000.0,150,90.0,Crystal key.png,Crystal key
973,How does it all fit in there?,8628,True,4.0,500.0,10,6.0,Crystal of power (flatpack).png,Crystal of power (flatpack)
974,A seed to be sung into the best tools of the craft.,23953,True,200000.0,,500000,300000.0,Crystal tool seed.png,Crystal tool seed
975,A seed to be sung into the finest crystal weapons.,4207,True,1.0,70.0,1,1.0,Crystal weapon seed.png,Crystal weapon seed
976,It's hot!,4460,True,4.0,13000.0,10,6.0,Cup of hot water.png,Cup of hot water
977,A nice cup of tea.,1978,True,4.0,2000.0,10,6.0,Cup of tea.png,Cup of tea
978,A cup of water.,4458,True,4.0,13000.0,10,6.0,Cup of water.png,Cup of water
979,Ready to be cut and sewn into armour.,10820,True,40.0,13000.0,100,60.0,Cured yak-hide.png,Cured yak-hide
980,It's a spicy hot curry.,2011,True,8.0,10000.0,20,12.0,Curry.png,Curry
981,I could make a spicy curry with this.,5970,True,7.0,11000.0,19,11.0,Curry leaf.png,Curry leaf
982,This sapling is ready to be replanted in a fruit tree patch.,5499,True,1.0,200.0,1,1.0,Curry sapling.png,Curry sapling
983,Plant in a plantpot of soil to grow a sapling.,5286,True,15.0,200.0,39,23.0,Curry tree seed 5.png,Curry tree seed
984,You'd expect this to interfere with your 3D vision.,19915,True,2000.0,4.0,5000,3000.0,Cyclops head.png,Cyclops head
985,These would feed a dogfish for months!,6729,True,60.0,7500.0,150,90.0,Dagannoth bones.png,Dagannoth bones
986,A sturdy piece of dagannoth hide.,6155,True,24.0,11000.0,60,36.0,Dagannoth hide.png,Dagannoth hide
987,A hat worn by members of the Dagon'hai.,24288,True,6800.0,,17000,10200.0,Dagon'hai hat.png,Dagon'hai hat
988,A robe worn by members of the Dagon'hai.,24294,True,36000.0,,90000,54000.0,Dagon'hai robe bottom.png,Dagon'hai robe bottom
989,A robe worn by members of the Dagon'hai.,24291,True,56000.0,,140000,84000.0,Dagon'hai robe top.png,Dagon'hai robe top
990,"A set containing a Dagon'hai hat, robe top and robe bottom.",24333,True,86800.0,,217000,130200.0,Dagon'hai robes set.png,Dagon'hai robes set
991,"Smells like the north end of a southbound monkey, because it is.",19665,True,1.0,13000.0,2,1.0,Damaged monkey tail.png,Damaged monkey tail
992,"A teleport to Dareeyak, in level 23 Wilderness.",12777,True,1.0,10000.0,1,1.0,Dareeyak teleport (tablet).png,Dareeyak teleport (tablet)
993,A bow from a darker dimension.,11235,True,48000.0,8.0,120002,72001.0,Dark bow.png,Dark bow
994,Bow ties are cool.,19970,True,2000.0,4.0,5000,3000.0,Dark bow tie.png,Dark bow tie
995,All for one and one for all!,2641,True,80.0,4.0,200,120.0,Dark cavalier.png,Dark cavalier
996,This looks tricky to eat.,11936,True,128.0,10000.0,320,192.0,Dark crab.png,Dark crab
997,What on earth would eat this?,11940,True,1.0,8000.0,3,1.0,Dark fishing bait.png,Dark fishing bait
998,Use on infinity pieces to recolour them!,12528,True,2000.0,4.0,5000,3000.0,Dark infinity colour kit.png,Dark infinity colour kit
999,"Sleek, silent and furry.",10115,True,84.0,10000.0,210,126.0,Dark kebbit fur.png,Dark kebbit fur
1000,Dark tuxedo trousers with white stockings.,19964,True,2400.0,4.0,6000,3600.0,Dark trousers.png,Dark trousers
1001,Linked tuxedo cuffs with a dark trim.,19961,True,1200.0,4.0,3000,1800.0,Dark tuxedo cuffs.png,Dark tuxedo cuffs
1002,A dark tuxedo jacket with a white shirt.,19958,True,4000.0,4.0,10000,6000.0,Dark tuxedo jacket.png,Dark tuxedo jacket
1003,Dark shoes to match your dark tuxedo.,19967,True,1200.0,4.0,3000,1800.0,Dark tuxedo shoes.png,Dark tuxedo shoes
1004,Nature's equivalent of go-faster stripes.,10127,True,108.0,10000.0,270,162.0,Dashing kebbit fur.png,Dashing kebbit fur
1005,Used for medium level missile spells.,560,False,72.0,25000.0,180,108.0,Death rune.png,Death rune
1006,A mysterious power emanates from the talisman...,1456,True,1.0,11000.0,4,2.0,Death talisman.png,Death talisman
1007,A tiara infused with the properties of death.,5547,True,40.0,40.0,100,60.0,Death tiara.png,Death tiara
1008,Elementary!,12540,True,920.0,4.0,2300,1380.0,Deerstalker.png,Deerstalker
1009,One dose of fishy Defence potion.,11459,True,24.0,2000.0,60,36.0,Defence mix(1).png,Defence mix(1)
1010,Two doses of fishy Defence potion.,11457,True,36.0,2000.0,90,54.0,Defence mix(2).png,Defence mix(2)
1011,1 dose of Defence potion.,137,True,24.0,2000.0,60,36.0,Defence potion(1).png,Defence potion(1)
1012,2 doses of Defence potion.,135,True,36.0,2000.0,90,54.0,Defence potion(2).png,Defence potion(2)
1013,3 doses of Defence potion.,133,True,48.0,2000.0,120,72.0,Defence potion(3).png,Defence potion(3)
1014,4 doses of Defence potion.,2432,True,60.0,2000.0,150,90.0,Defence potion(4).png,Defence potion(4)
1015,Vicious demon slippers.,23294,False,400.0,4.0,1000,600.0,Demon feet.png,Demon feet
1016,Comfortable desert shoes.,1837,True,8.0,150.0,20,12.0,Desert boots.png,Desert boots
1017,These should make me harder to spot in desert areas.,10063,True,8.0,150.0,20,12.0,Desert camo legs.png,Desert camo legs
1018,This should make me harder to spot in desert areas.,10061,True,8.0,150.0,20,12.0,Desert camo top.png,Desert camo top
1019,Sandy coloured kebbit fur.,10123,True,6.0,10000.0,17,10.0,Desert devil fur.png,Desert devil fur
1020,Not much good for blowing.,9735,True,4.0,13000.0,12,7.0,Desert goat horn.png,Desert goat horn
1021,Better than factor 50 sun cream.,6390,True,10.0,150.0,25,15.0,Desert legs.png,Desert legs
1022,"A cool, light desert robe.",1835,True,16.0,150.0,40,24.0,Desert robe.png,Desert robe
1023,Has a coarse hard wearing texture.,6386,True,10.0,150.0,25,15.0,Desert robes.png,Desert robes
1024,"A cool, light desert shirt.",1833,True,16.0,150.0,40,24.0,Desert shirt.png,Desert shirt
1025,A bit itchy.,6384,True,6.0,150.0,15,9.0,Desert top.png,Desert top
1026,Good for those cold desert nights.,6388,True,14.0,150.0,35,21.0,Desert top (overcoat).png,Desert top (overcoat)
1027,A pair of Devout Boots.,22954,True,8000.0,70.0,20000,12000.0,Devout boots.png,Devout boots
1028,Scrawled words that can invoke the power of the gods.,21034,True,32000.0,5.0,80000,48000.0,Dexterous prayer scroll.png,Dexterous prayer scroll
1029,"A set containing a Dharok's helm, platelegs, platebody and greataxe.",12877,True,160000.0,8.0,400000,240000.0,Dharok's armour set.png,Dharok's armour set
1030,Dharok the Wretched's greataxe.,4718,True,83200.0,15.0,208000,124800.0,Dharok's greataxe.png,Dharok's greataxe
1031,Dharok the Wretched's greataxe.,4890,True,83200.0,15.0,208000,124800.0,Dharok's greataxe 0.png,Dharok's greataxe 0
1032,Dharok the Wretched's helm.,4716,True,41200.0,15.0,103000,61800.0,Dharok's helm.png,Dharok's helm
1033,Dharok the Wretched's helm.,4884,True,41200.0,15.0,103000,61800.0,Dharok's helm 0.png,Dharok's helm 0
1034,Dharok the Wretched's platebody armour.,4720,True,112000.0,15.0,280000,168000.0,Dharok's platebody.png,Dharok's platebody
1035,Dharok the Wretched's platebody armour.,4896,True,112000.0,15.0,280000,168000.0,Dharok's platebody 0.png,Dharok's platebody 0
1036,Dharok the Wretched's plate leg armour.,4722,True,110000.0,15.0,275000,165000.0,Dharok's platelegs.png,Dharok's platelegs
1037,Dharok the Wretched's plate leg armour.,4902,True,110000.0,15.0,275000,165000.0,Dharok's platelegs 0.png,Dharok's platelegs 0
1038,This looks valuable.,1601,False,800.0,11000.0,2000,1200.0,Diamond.png,Diamond
1039,I wonder if I can get this enchanted.,1700,False,1410.0,10000.0,3525,2115.0,Diamond amulet.png,Diamond amulet
1040,It needs a string so I can wear it.,1681,False,1410.0,10000.0,3525,2115.0,Diamond amulet (u).png,Diamond amulet (u)
1041,Diamond bolt tips.,9192,True,53.0,11000.0,133,79.0,Diamond bolt tips 5.png,Diamond bolt tips
1042,Diamond tipped Adamantite crossbow bolts.,9340,True,76.0,11000.0,192,115.0,Diamond bolts 5.png,Diamond bolts
1043,Enchanted Diamond tipped Adamantite Crossbow Bolts.,9243,True,84.0,11000.0,211,126.0,Diamond bolts (e) 5.png,Diamond bolts (e)
1044,I wonder if this is valuable.,11092,True,1530.0,10000.0,3825,2295.0,Diamond bracelet.png,Diamond bracelet
1045,"Dragon crossbow bolts, tipped with diamond.",21969,True,340.0,11000.0,850,510.0,Diamond dragon bolts 5.png,Diamond dragon bolts
1046,"Enchanted Dragon crossbow bolts, tipped with diamond.",21946,True,352.0,11000.0,880,528.0,Diamond dragon bolts (e) 5.png,Diamond dragon bolts (e)
1047,I wonder if this is valuable.,1662,False,1470.0,18000.0,3675,2205.0,Diamond necklace.png,Diamond necklace
1048,A valuable ring.,1643,False,1410.0,10000.0,3525,2115.0,Diamond ring.png,Diamond ring
1049,Teleports you to the Digsite.,12403,True,4.0,10000.0,10,6.0,Digsite teleport.png,Digsite teleport
1050,Is it... looking at me?,21015,True,224000.0,8.0,560000,336000.0,Dinh's bulwark.png,Dinh's bulwark
1051,Used to get out of Thordur's blackhole.,981,False,48.0,50.0,120,72.0,Disk of returning.png,Disk of returning
1052,1 dose of divine bastion potion.,24644,True,1.0,2000.0,1,1.0,Divine bastion potion(1).png,Divine bastion potion(1)
1053,2 doses of divine bastion potion.,24641,True,1.0,2000.0,1,1.0,Divine bastion potion(2).png,Divine bastion potion(2)
1054,3 doses of divine bastion potion.,24638,True,1.0,2000.0,1,1.0,Divine bastion potion(3).png,Divine bastion potion(3)
1055,4 doses of divine bastion potion.,24635,True,1.0,2000.0,1,1.0,Divine bastion potion(4).png,Divine bastion potion(4)
1056,1 dose of divine battlemage potion.,24632,True,1.0,2000.0,1,1.0,Divine battlemage potion(1).png,Divine battlemage potion(1)
1057,2 doses of divine battlemage potion.,24629,True,1.0,2000.0,1,1.0,Divine battlemage potion(2).png,Divine battlemage potion(2)
1058,3 doses of divine battlemage potion.,24626,True,1.0,2000.0,1,1.0,Divine battlemage potion(3).png,Divine battlemage potion(3)
1059,4 doses of divine battlemage potion.,24623,True,1.0,2000.0,1,1.0,Divine battlemage potion(4).png,Divine battlemage potion(4)
1060,1 dose of divine magic potion.,23754,True,16.0,2000.0,40,24.0,Divine magic potion(1).png,Divine magic potion(1)
1061,2 doses of divine magic potion.,23751,True,36.0,2000.0,90,54.0,Divine magic potion(2).png,Divine magic potion(2)
1062,3 doses of divine magic potion.,23748,True,68.0,2000.0,170,102.0,Divine magic potion(3).png,Divine magic potion(3)
1063,4 doses of divine magic potion.,23745,True,100.0,2000.0,250,150.0,Divine magic potion(4).png,Divine magic potion(4)
1064,1 dose of divine ranging potion.,23742,True,16.0,2000.0,40,24.0,Divine ranging potion(1).png,Divine ranging potion(1)
1065,2 doses of divine ranging potion.,23739,True,36.0,2000.0,90,54.0,Divine ranging potion(2).png,Divine ranging potion(2)
1066,3 doses of divine ranging potion.,23736,True,68.0,2000.0,170,102.0,Divine ranging potion(3).png,Divine ranging potion(3)
1067,4 doses of divine ranging potion.,23733,True,100.0,2000.0,250,150.0,Divine ranging potion(4).png,Divine ranging potion(4)
1068,1 dose of divine super attack potion.,23706,True,16.0,2000.0,40,24.0,Divine super attack potion(1).png,Divine super attack potion(1)
1069,2 doses of divine super attack potion.,23703,True,36.0,2000.0,90,54.0,Divine super attack potion(2).png,Divine super attack potion(2)
1070,3 doses of divine super attack potion.,23700,True,68.0,2000.0,170,102.0,Divine super attack potion(3).png,Divine super attack potion(3)
1071,4 doses of divine super attack potion.,23697,True,100.0,2000.0,250,150.0,Divine super attack potion(4).png,Divine super attack potion(4)
1072,1 dose of divine super combat potion.,23694,True,16.0,2000.0,40,24.0,Divine super combat potion(1).png,Divine super combat potion(1)
1073,2 doses of divine super combat potion.,23691,True,36.0,2000.0,90,54.0,Divine super combat potion(2).png,Divine super combat potion(2)
1074,3 doses of divine super combat potion.,23688,True,68.0,2000.0,170,102.0,Divine super combat potion(3).png,Divine super combat potion(3)
1075,4 doses of divine super combat potion.,23685,True,100.0,2000.0,250,150.0,Divine super combat potion(4).png,Divine super combat potion(4)
1076,1 dose of divine super defence potion.,23730,True,16.0,2000.0,40,24.0,Divine super defence potion(1).png,Divine super defence potion(1)
1077,2 doses of divine super defence potion.,23727,True,36.0,2000.0,90,54.0,Divine super defence potion(2).png,Divine super defence potion(2)
1078,3 doses of divine super defence potion.,23724,True,68.0,2000.0,170,102.0,Divine super defence potion(3).png,Divine super defence potion(3)
1079,4 doses of divine super defence potion.,23721,True,100.0,2000.0,250,150.0,Divine super defence potion(4).png,Divine super defence potion(4)
1080,1 dose of divine super strength potion.,23718,True,16.0,2000.0,40,24.0,Divine super strength potion(1).png,Divine super strength potion(1)
1081,2 doses of divine super strength potion.,23715,True,36.0,2000.0,90,54.0,Divine super strength potion(2).png,Divine super strength potion(2)
1082,3 doses of divine super strength potion.,23712,True,68.0,2000.0,170,102.0,Divine super strength potion(3).png,Divine super strength potion(3)
1083,4 doses of divine super strength potion.,23709,True,100.0,2000.0,250,150.0,Divine super strength potion(4).png,Divine super strength potion(4)
1084,Lets you get away with it - sometimes.,21143,True,420.0,10000.0,1050,630.0,Dodgy necklace.png,Dodgy necklace
1085,"A tasty herb, good for seasoning.",1573,True,1.0,15.0,2,1.0,Doogle leaves.png,Doogle leaves
1086,This fires crossbow bolts.,8880,True,800.0,70.0,2000,1200.0,Dorgeshuun crossbow.png,Dorgeshuun crossbow
1087,A black piece of cloth on a string.,19727,True,1.0,4.0,2,1.0,Double eye patch.png,Double eye patch
1088,It looks like this could be attached to a shield somehow.,11286,True,300000.0,5.0,750000,450000.0,Draconic visage.png,Draconic visage
1089,A two-handed Dragon Sword.,7158,True,88000.0,8.0,220000,132000.0,Dragon 2h sword.png,Dragon 2h sword
1090,"A set containing a full helm, platebody, legs and kiteshield.",21882,True,200000.0,8.0,500000,300000.0,Dragon armour set (lg).png,Dragon armour set (lg)
1091,"A set containing a full helm, platebody, skirt and kiteshield.",21885,True,200000.0,8.0,500000,300000.0,Dragon armour set (sk).png,Dragon armour set (sk)
1092,An arrow made using a dragon's talon.,11212,True,320.0,11000.0,800,480.0,Dragon arrow 5.png,Dragon arrow
1093,Venomous-looking arrows.,11227,True,320.0,11000.0,800,480.0,Dragon arrow(p) 5.png,Dragon arrow(p)
1094,Venomous-looking arrows.,11228,True,320.0,11000.0,800,480.0,Dragon arrow(p+) 5.png,Dragon arrow(p+)
1095,Venomous-looking arrows.,11229,True,320.0,11000.0,800,480.0,Dragon arrow(p++) 5.png,Dragon arrow(p++)
1096,"Dragon talons, usable as arrowheads.",11237,True,200.0,10000.0,500,300.0,Dragon arrowtips.png,Dragon arrowtips
1097,A very powerful axe.,6739,True,22000.0,40.0,55000,33000.0,Dragon axe.png,Dragon axe
1098,A vicious looking axe.,1377,True,80000.0,70.0,200000,120000.0,Dragon battleaxe.png,Dragon battleaxe
1099,A glass of bitter.,1911,True,1.0,2000.0,2,1.0,Dragon bitter.png,Dragon bitter
1100,How does it all fit in there?,8524,True,4.0,500.0,10,6.0,Dragon bitter (flatpack).png,Dragon bitter (flatpack)
1101,This keg contains 4 pints of Dragon Bitter.,5809,True,1.0,2000.0,1,1.0,Dragon bitter(4).png,Dragon bitter(4)
1102,This looks a good deal stronger than normal Dragon Bitter.,5745,True,1.0,2000.0,2,1.0,Dragon bitter(m).png,Dragon bitter(m)
1103,This keg contains 4 pints of mature Dragon Bitter.,5889,True,1.0,2000.0,1,1.0,Dragon bitter(m4).png,Dragon bitter(m4)
1104,Dragon crossbow bolts.,21905,True,170.0,11000.0,425,255.0,Dragon bolts 5.png,Dragon bolts
1105,Some poisoned dragon bolts.,21924,True,172.0,11000.0,430,258.0,Dragon bolts (p) 5.png,Dragon bolts (p)
1106,Some poisoned dragon bolts.,21926,True,174.0,11000.0,435,261.0,Dragon bolts (p+) 5.png,Dragon bolts (p+)
1107,Some poisoned dragon bolts.,21928,True,176.0,11000.0,440,264.0,Dragon bolts (p++) 5.png,Dragon bolts (p++)
1108,Unfeathered dragon crossbow bolts.,21930,True,56.0,13000.0,141,84.0,Dragon bolts (unf) 5.png,Dragon bolts (unf)
1109,These would feed a dog for months!,536,True,64.0,7500.0,160,96.0,Dragon bones.png,Dragon bones
1110,These will protect my feet.,11840,True,8000.0,70.0,20000,12000.0,Dragon boots.png,Dragon boots
1111,Use on some dragon boots to make them look fancier!,22231,True,2000.0,4.0,5000,3000.0,Dragon boots ornament kit.png,Dragon boots ornament kit
1112,An onyx topped cane.,12373,True,12000.0,4.0,30000,18000.0,Dragon cane.png,Dragon cane
1113,A series of connected metal rings.,3140,True,100000.0,70.0,250000,150000.0,Dragon chainbody.png,Dragon chainbody
1114,Use on a dragon chainbody to make it look fancier!,12534,True,2000.0,4.0,5000,3000.0,Dragon chainbody ornament kit.png,Dragon chainbody ornament kit
1115,A set of fighting claws.,13652,True,82000.0,8.0,205000,123000.0,Dragon claws.png,Dragon claws
1116,A dragon crossbow.,21902,True,21600.0,70.0,54000,32400.0,Dragon crossbow.png,Dragon crossbow
1117,An unstrung dragon crossbow.,21921,True,12000.0,10000.0,30000,18000.0,Dragon crossbow (u).png,Dragon crossbow (u)
1118,A powerful dagger.,1215,True,12000.0,70.0,30000,18000.0,Dragon dagger.png,Dragon dagger
1119,A powerful dagger.,1231,True,9600.0,70.0,24000,14400.0,Dragon dagger(p).png,Dragon dagger(p)
1120,A powerful dagger.,5680,True,9600.0,70.0,24000,14400.0,Dragon dagger(p+).png,Dragon dagger(p+)
1121,A powerful dagger.,5698,True,9600.0,70.0,24000,14400.0,Dragon dagger(p++).png,Dragon dagger(p++)
1122,A deadly throwing dart with a dragon tip.,11230,True,200.0,11000.0,500,300.0,Dragon dart.png,Dragon dart
1123,A deadly looking dragon dart tip - needs feathers for flight.,11232,True,100.0,11000.0,250,150.0,Dragon dart tip.png,Dragon dart tip
1124,A deadly poisoned dart with a dragon tip.,11231,True,200.0,11000.0,500,300.0,Dragon dart(p).png,Dragon dart(p)
1125,A deadly poisoned dart with a dragon tip.,11233,True,200.0,11000.0,500,300.0,Dragon dart(p+).png,Dragon dart(p+)
1126,A deadly poisoned dart with a dragon tip.,11234,True,200.0,11000.0,500,300.0,Dragon dart(p++).png,Dragon dart(p++)
1127,Use on the dragon defender to trim it with gold.,20143,True,2000.0,4.0,5000,3000.0,Dragon defender ornament kit.png,Dragon defender ornament kit
1128,Protects your head and looks impressive too.,11335,True,60000.0,8.0,150000,90000.0,Dragon full helm.png,Dragon full helm
1129,Use on a dragon full helm to make it look fancier!,12538,True,2000.0,4.0,5000,3000.0,Dragon full helm ornament kit.png,Dragon full helm ornament kit
1130,A dragon halberd.,3204,True,100000.0,70.0,250000,150000.0,Dragon halberd.png,Dragon halberd
1131,A very powerful harpoon.,21028,True,22000.0,5.0,55000,33000.0,Dragon harpoon.png,Dragon harpoon
1132,A one-handed dragon hasta.,22731,True,24960.0,70.0,62400,37440.0,Dragon hasta.png,Dragon hasta
1133,"A poison-tipped, one-handed dragon hasta",22734,True,24960.0,70.0,62400,37440.0,Dragon hasta(p).png,Dragon hasta(p)
1134,"A poison-tipped, one-handed dragon hasta",22737,True,24960.0,70.0,62400,37440.0,Dragon hasta(p+).png,Dragon hasta(p+)
1135,"A poison-tipped, one-handed dragon hasta",22740,True,24960.0,70.0,62400,37440.0,Dragon hasta(p++).png,Dragon hasta(p++)
1136,A crossbow used for dragon hunting.,21012,True,32000.0,8.0,80000,48000.0,Dragon hunter crossbow.png,Dragon hunter crossbow
1137,A lance that is exceptionally good at killing dragons and their ilk.,22978,True,120000.0,8.0,300000,180000.0,Dragon hunter lance.png,Dragon hunter lance
1138,Dragon impling in a jar.,11256,True,20.0,18000.0,50,30.0,Dragon impling jar.png,Dragon impling jar
1139,A dragon tipped javelin.,19484,True,180.0,11000.0,450,270.0,Dragon javelin.png,Dragon javelin
1140,Needs a shaft.,19582,True,780.0,10000.0,1950,1170.0,Dragon javelin heads 5.png,Dragon javelin heads
1141,A dragon tipped javelin.,19486,True,180.0,11000.0,450,270.0,Dragon javelin(p).png,Dragon javelin(p)
1142,A dragon tipped javelin.,19488,True,180.0,11000.0,450,270.0,Dragon javelin(p+).png,Dragon javelin(p+)
1143,A dragon tipped javelin.,19490,True,180.0,11000.0,450,270.0,Dragon javelin(p++).png,Dragon javelin(p++)
1144,An ancient and powerful looking Dragon Kiteshield.,21895,True,640000.0,70.0,1600000,960000.0,Dragon kiteshield.png,Dragon kiteshield
1145,Use on a dragon kiteshield to make it look fancier!,22239,True,2000.0,4.0,5000,3000.0,Dragon kiteshield ornament kit.png,Dragon kiteshield ornament kit
1146,A finely balanced and powerful throwing knife.,22804,True,66.0,11000.0,167,100.0,Dragon knife.png,Dragon knife
1147,A finely balanced and powerful throwing knife.,22806,True,66.0,7000.0,166,99.0,Dragon knife(p).png,Dragon knife(p)
1148,A finely balanced and powerful throwing knife.,22808,True,66.0,7000.0,166,99.0,Dragon knife(p+).png,Dragon knife(p+)
1149,A finely balanced and powerful throwing knife.,22810,True,66.0,7000.0,166,99.0,Dragon knife(p++).png,Dragon knife(p++)
1150,Use on dragon platelegs or plateskirt to make them look fancier!,12536,True,2000.0,4.0,5000,3000.0,Dragon legs+skirt ornament kit.png,Dragon legs/skirt ornament kit
1151,A pair of dragon crossbow limbs.,21918,True,14000.0,10000.0,35000,21000.0,Dragon limbs.png,Dragon limbs
1152,A very powerful sword.,1305,True,40000.0,70.0,100000,60000.0,Dragon longsword.png,Dragon longsword
1153,A spiky mace.,1434,True,20000.0,70.0,50000,30000.0,Dragon mace.png,Dragon mace
1154,Makes the wearer pretty intimidating.,1149,True,40000.0,8.0,100000,60000.0,Dragon med helm.png,Dragon med helm
1155,A badly damaged lump of dragon metal.,22103,True,60000.0,50.0,150000,90000.0,Dragon metal lump.png,Dragon metal lump
1156,A badly damaged shard of dragon metal.,22097,True,480000.0,50.0,1200000,720000.0,Dragon metal shard.png,Dragon metal shard
1157,A badly damaged slice of dragon metal.,22100,True,40000.0,50.0,100000,60000.0,Dragon metal slice.png,Dragon metal slice
1158,I wonder if this is valuable.,1664,True,7350.0,10000.0,18375,11025.0,Dragon necklace.png,Dragon necklace
1159,"If rocks could feel fear, they'd fear this.",11920,True,39180.0,40.0,97950,58770.0,Dragon pickaxe.png,Dragon pickaxe
