,examine,id,members,lowalch,limit,value,highalch,icon,name
2832,This looks valuable.,1607,False,100.0,13000.0,250,150.0,Sapphire.png,Sapphire
2833,I wonder if I can get this enchanted.,1694,False,360.0,10000.0,900,540.0,Sapphire amulet.png,Sapphire amulet
2834,It needs a string so I can wear it.,1675,False,360.0,10000.0,900,540.0,Sapphire amulet (u).png,Sapphire amulet (u)
2835,Sapphire bolt tips.,9189,True,6.0,11000.0,17,10.0,Sapphire bolt tips 5.png,Sapphire bolt tips
2836,Sapphire tipped Mithril crossbow bolts.,9337,True,14.0,11000.0,37,22.0,Sapphire bolts 5.png,Sapphire bolts
2837,Enchanted Sapphire tipped Mithril Crossbow Bolts.,9240,True,16.0,11000.0,40,24.0,Sapphire bolts (e) 5.png,Sapphire bolts (e)
2838,I wonder if this is valuable.,11072,True,460.0,10000.0,1150,690.0,Sapphire bracelet.png,Sapphire bracelet
2839,"Dragon crossbow bolts, tipped with sapphire.",21963,True,300.0,11000.0,750,450.0,Sapphire dragon bolts 5.png,Sapphire dragon bolts
2840,"Enchanted Dragon crossbow bolts, tipped with sapphire.",21940,True,312.0,11000.0,780,468.0,Sapphire dragon bolts (e) 5.png,Sapphire dragon bolts (e)
2841,There's a sapphire glacialis butterfly in here.,10018,True,12.0,125.0,30,18.0,Sapphire glacialis (item).png,Sapphire glacialis (item)
2842,I wonder if this is valuable.,1656,False,420.0,18000.0,1050,630.0,Sapphire necklace.png,Sapphire necklace
2843,A valuable ring.,1637,False,360.0,10000.0,900,540.0,Sapphire ring.png,Sapphire ring
2844,Not to be confused with a Sarachnis cuddle.,23528,True,48000.0,70.0,120001,72000.0,Sarachnis cudgel.png,Sarachnis cudgel
2845,"A set containing a full helm, platebody, legs and kiteshield.",13040,False,32000.0,8.0,80000,48000.0,Saradomin armour set (lg).png,Saradomin armour set (lg)
2846,"A set containing a full helm, platebody, skirt and kiteshield.",13042,False,32000.0,8.0,80000,48000.0,Saradomin armour set (sk).png,Saradomin armour set (sk)
2847,Saradomin blessed dragonhide vambraces.,10384,True,1600.0,8.0,4000,2400.0,Saradomin bracers.png,Saradomin bracers
2848,1 dose of Saradomin brew.,6691,True,50.0,2000.0,125,75.0,Saradomin brew(1).png,Saradomin brew(1)
2849,2 doses of Saradomin brew.,6689,True,60.0,2000.0,150,90.0,Saradomin brew(2).png,Saradomin brew(2)
2850,3 doses of Saradomin brew.,6687,True,70.0,2000.0,175,105.0,Saradomin brew(3).png,Saradomin brew(3)
2851,4 doses of Saradomin brew.,6685,True,80.0,2000.0,200,120.0,Saradomin brew(4).png,Saradomin brew(4)
2852,Saradomin blessed dragonhide chaps.,10388,True,2400.0,8.0,6000,3600.0,Saradomin chaps.png,Saradomin chaps
2853,A Saradomin cloak.,10446,True,800.0,8.0,2000,1200.0,Saradomin cloak.png,Saradomin cloak
2854,Saradomin blessed dragonhide coif.,10390,True,800.0,8.0,2000,1200.0,Saradomin coif.png,Saradomin coif
2855,A Saradomin crozier.,10440,True,2000.0,8.0,5000,3000.0,Saradomin crozier.png,Saradomin crozier
2856,Saradomin blessed dragonhide body armour.,10386,True,5200.0,8.0,13000,7800.0,Saradomin d'hide body.png,Saradomin d'hide body
2857,Saradomin blessed dragonhide boots.,19933,True,3720.0,8.0,9300,5580.0,Saradomin d'hide boots.png,Saradomin d'hide boots
2858,Saradomin blessed wooden shield covered in dragon leather.,23191,True,11333.0,8.0,28334,17000.0,Saradomin d'hide shield.png,Saradomin d'hide shield
2859,"A set containing a Saradomin dragonhide coif, body, chaps and vambraces.",13163,True,3600.0,8.0,9000,5400.0,Saradomin dragonhide set.png,Saradomin dragonhide set
2860,Rune full helmet in the colours of Saradomin.,2665,False,14080.0,8.0,35200,21120.0,Saradomin full helm.png,Saradomin full helm
2861,"A gracious, heavy sword.",11806,True,500000.0,8.0,1250000,750000.0,Saradomin godsword.png,Saradomin godsword
2862,Use on a Saradomin godsword to make it look fancier!,20074,True,2000.0,4.0,5000,3000.0,Saradomin godsword ornament kit.png,Saradomin godsword ornament kit
2863,Brimming with potential.,11814,True,200000.0,10000.0,500000,300000.0,Saradomin hilt.png,Saradomin hilt
2864,Rune kiteshield in the colours of Saradomin.,2667,False,21760.0,8.0,54400,32640.0,Saradomin kiteshield.png,Saradomin kiteshield
2865,A Saradomin mitre.,10452,True,2000.0,8.0,5000,3000.0,Saradomin mitre.png,Saradomin mitre
2866,A Saradomin Mjolnir.,6762,True,250.0,8.0,625,375.0,Saradomin mjolnir.png,Saradomin mjolnir
2867,This seems to have been torn from a book...,3827,True,80.0,5.0,200,120.0,Saradomin page 1.png,Saradomin page 1
2868,This seems to have been torn from a book...,3828,True,80.0,5.0,200,120.0,Saradomin page 2.png,Saradomin page 2
2869,This seems to have been torn from a book...,3829,True,80.0,5.0,200,120.0,Saradomin page 3.png,Saradomin page 3
2870,This seems to have been torn from a book...,3830,True,80.0,5.0,200,120.0,Saradomin page 4.png,Saradomin page 4
2871,Rune platebody in the colours of Saradomin.,2661,False,26000.0,8.0,65000,39000.0,Saradomin platebody.png,Saradomin platebody
2872,Rune platelegs in the colours of Saradomin.,2663,False,25600.0,8.0,64000,38400.0,Saradomin platelegs.png,Saradomin platelegs
2873,Rune plateskirt in the colours of Saradomin.,3479,False,25600.0,8.0,64000,38400.0,Saradomin plateskirt.png,Saradomin plateskirt
2874,Leggings from the Saradomin Vestments.,10464,True,2800.0,8.0,7000,4200.0,Saradomin robe legs.png,Saradomin robe legs
2875,Saradomin Vestments.,10458,True,2800.0,8.0,7000,4200.0,Saradomin robe top.png,Saradomin robe top
2876,A Saradomin stole.,10470,True,1000.0,8.0,2500,1500.0,Saradomin stole.png,Saradomin stole
2877,The incredible blade of an Icyene.,11838,True,52000.0,8.0,130000,78000.0,Saradomin sword.png,Saradomin sword
2878,The starlight enlightens your mind to dispel the darkness of Zamorakian evil.,13256,True,13840.0,5.0,34600,20760.0,Saradomin's light.png,Saradomin's light
2879,"After a terrible battle, Saradomin wept over the wounds of his faithful Zilyana.",12804,True,16000.0,50.0,40000,24000.0,Saradomin's tear.png,Saradomin's tear
2880,Some nicely cooked sardines.,325,False,4.0,6000.0,10,6.0,Sardine.png,Sardine
2881,Good for cutting wood.,8794,True,4.0,40.0,10,6.0,Saw.png,Saw
2882,A bowl of scrambled egg.,7078,True,3.0,13000.0,8,4.0,Scrambled egg.png,Scrambled egg
2883,A powerful scythe. It is currently uncharged.,22486,True,1600000.0,8.0,4000000,2400000.0,Scythe of vitur (uncharged).png,Scythe of vitur (uncharged)
2884,Tasty!,397,True,80.0,10000.0,200,120.0,Sea turtle.png,Sea turtle
2885,Sardine flavoured with doogle leaves.,1552,True,4.0,15.0,10,6.0,Seasoned sardine.png,Seasoned sardine
2886,Slightly damp seaweed.,401,True,1.0,13000.0,2,1.0,Seaweed.png,Seaweed
2887,A seaweed spore - plant in a seaweed patch.,21490,True,8.0,600.0,20,12.0,Seaweed spore 5.png,Seaweed spore
2888,Good for pruning away diseased leaves.,5329,True,2.0,40.0,5,3.0,Secateurs.png,Secateurs
2889,WARNING: Contains information which could make your account secure!,9003,False,1.0,15.0,2,1.0,Security book.png,Security book
2890,Use this to plant seeds with.,5343,True,2.0,40.0,6,3.0,Seed dibber.png,Seed dibber
2891,An ancient Fremennik bow that was once used to battle the Moon Clan.,6724,True,3200.0,8.0,8000,4800.0,Seercull.png,Seercull
2892,A mysterious ring that can fill the wearer with magical power...,6731,True,4000.0,8.0,10000,6000.0,Seers ring.png,Seers ring
2893,A teleport to Senntisten.,12782,True,1.0,10000.0,1,1.0,Senntisten teleport (tablet).png,Senntisten teleport (tablet)
2894,Needs to be charged with Zulrah's scales.,12929,True,44000.0,8.0,110000,66000.0,Serpentine helm (uncharged).png,Serpentine helm (uncharged)
2895,Maybe you could use a chisel to craft this into a helmet.,12927,True,42000.0,5.0,105000,63000.0,Serpentine visage.png,Serpentine visage
2896,1 dose serum 207 as described in Herbi Flax's diary.,3414,True,4.0,2000.0,11,6.0,Serum 207 (1).png,Serum 207 (1)
2897,2 doses serum 207 as described in Herbi Flax's diary.,3412,True,5.0,2000.0,13,7.0,Serum 207 (2).png,Serum 207 (2)
2898,3 doses serum 207 as described in Herbi Flax's diary.,3410,True,5.0,2000.0,13,7.0,Serum 207 (3).png,Serum 207 (3)
2899,4 doses serum 207 as described in Herbi Flax's diary.,3408,True,5.0,2000.0,14,8.0,Serum 207 (4).png,Serum 207 (4)
2900,"If a shade had knees, this would keep them nice and warm.",548,False,12.0,125.0,30,18.0,Shade robe.png,Shade robe
2901,I feel closer to the gods when I am wearing this.,546,False,16.0,125.0,40,24.0,Shade robe top.png,Shade robe top
2902,Large glistening bones which glow with a pale yellow aura.,3123,True,1.0,7500.0,1,1.0,Shaikahan bones.png,Shaikahan bones
2903,The mask worn by ogre shamans.,21838,False,3200.0,125.0,8000,4800.0,Shaman mask.png,Shaman mask
2904,Allows you to pass through the Shantay pass into the Kharid Desert.,1854,True,2.0,18000.0,5,3.0,Shantay pass (item).png,Shantay pass (item)
2905,I'd better be careful eating this.,385,True,68.0,10000.0,170,102.0,Shark.png,Shark
2906,How does it all fit in there?,8596,True,4.0,500.0,10,6.0,Shaving stand (flatpack).png,Shaving stand (flatpack)
2907,A war torn banner baring the sigil of house Shayzien.,20263,True,28.0,4.0,70,42.0,Shayzien banner.png,Shayzien banner
2908,A rare hood from Shayzien.,20125,True,1.0,4.0,1,1.0,Shayzien hood.png,Shayzien hood
2909,A red scarf adorned with a skull.,19955,True,4000.0,4.0,10000,6000.0,Shayzien scarf.png,Shayzien scarf
2910,For shearing sheep.,1735,False,1.0,40.0,1,1.0,Shears.png,Shears
2911,The left half of a dragon square shield.,2366,True,44000.0,50.0,110000,66000.0,Shield left half.png,Shield left half
2912,The right half of a dragon square shield.,2368,True,200000.0,50.0,500000,300000.0,Shield right half.png,Shield right half
2913,Allows you passage on the 'Lady of the waves' ship.,621,True,2.0,18000.0,5,3.0,Ship ticket.png,Ship ticket
2914,Tiny!,5030,True,180.0,150.0,450,270.0,Shirt (brown).png,Shirt (brown)
2915,Tiny!,5034,True,250.0,150.0,625,375.0,Shirt (lilac).png,Shirt (lilac)
2916,Tiny!,5032,True,240.0,150.0,600,360.0,Shirt (yellow).png,Shirt (yellow)
2917,How does it all fit in there?,8610,True,4.0,500.0,10,6.0,Shoe box (flatpack).png,Shoe box (flatpack)
2918,A Short Green Guy... looks good.,2080,True,12.0,2000.0,30,18.0,Short green guy.png,Short green guy
2919,Short but effective.,841,False,20.0,18000.0,50,30.0,Shortbow.png,Shortbow
2920,I need to find a string for this.,50,True,9.0,10000.0,23,13.0,Shortbow (u).png,Shortbow (u)
2921,"Blue shorts, these would look great on dwarves!",5046,True,156.0,150.0,390,234.0,Shorts (blue).png,Shorts (blue)
2922,"These look great, on dwarves!",5042,True,112.0,150.0,280,168.0,Shorts (brown).png,Shorts (brown)
2923,Yellow shorts. Far too small for you.,5044,True,144.0,150.0,360,216.0,Shorts (yellow).png,Shorts (yellow)
2924,Polly want a cracker?,23300,False,400.0,4.0,1000,600.0,Shoulder parrot.png,Shoulder parrot
2925,Some nicely cooked shrimp.,315,False,2.0,6000.0,5,3.0,Shrimps.png,Shrimps
2926,A shrunk ogleroot! How odd...,11205,True,1.0,15.0,2,1.0,Shrunk ogleroot 5.png,Shrunk ogleroot
2927,Used to make sickles.,2976,True,4.0,40.0,10,6.0,Sickle mould.png,Sickle mould
2928,It's a sheet of silk.,950,False,12.0,18000.0,30,18.0,Silk.png,Silk
2929,It's a bar of silver.,2355,False,60.0,10000.0,150,90.0,Silver bar.png,Silver bar
2930,Silver crossbow bolts.,9145,True,2.0,11000.0,5,3.0,Silver bolts 5.png,Silver bolts
2931,Some poisoned silver bolts.,9292,True,2.0,11000.0,5,3.0,Silver bolts (p) 5.png,Silver bolts (p)
2932,Some poisoned silver bolts.,9299,True,2.0,11000.0,5,3.0,Silver bolts (p+) 5.png,Silver bolts (p+)
2933,Some poisoned silver bolts.,9306,True,2.0,11000.0,5,3.0,Silver bolts (p++) 5.png,Silver bolts (p++)
2934,Unfeathered silver crossbow bolts.,9382,True,1.0,13000.0,1,1.0,Silver bolts (unf) 5.png,Silver bolts (unf)
2935,It's ground up silver.,7650,True,80.0,13000.0,200,120.0,Silver dust.png,Silver dust
2936,Perhaps someone can do something with this.,25451,True,7680.0,,19200,11520.0,Silver locks.png,Silver locks
2937,This needs refining.,442,False,30.0,13000.0,75,45.0,Silver ore.png,Silver ore
2938,It's a silver sickle.,2961,True,70.0,15.0,175,105.0,Silver sickle.png,Silver sickle
2939,I can use this to make a crossbow string.,9436,True,1.0,13000.0,2,1.0,Sinew.png,Sinew
2940,You get a sense of dread from this key.,993,True,32.0,11000.0,80,48.0,Sinister key.png,Sinister key
2941,"Some finely crafted Fremennik boots, made from the bones of a wallasalki.",6147,True,260.0,125.0,650,390.0,Skeletal boots.png,Skeletal boots
2942,A superior set of strengthened slacks for any self respecting seer.,6141,True,16000.0,70.0,40000,24000.0,Skeletal bottoms.png,Skeletal bottoms
2943,Fremennik gloves stitched together from wallasalki bones fragments.,6153,True,260.0,125.0,650,390.0,Skeletal gloves.png,Skeletal gloves
2944,Make your foes cower by wearing a skull as a helmet!,6137,True,4000.0,70.0,10000,6000.0,Skeletal helm.png,Skeletal helm
2945,The bones in this armour seem to vibrate with a magical quality...,6139,True,18000.0,70.0,45000,27000.0,Skeletal top.png,Skeletal top
2946,It looks like this could be attached to a shield somehow.,22006,True,600000.0,5.0,1500000,900000.0,Skeletal visage.png,Skeletal visage
2947,Generally used for impaling fresh meat.,7443,True,1280.0,50.0,3200,1920.0,Skewer.png,Skewer
2948,"A sharp pointed stick, quite resistant to fire.",6305,True,4.0,13000.0,10,6.0,Skewer stick.png,Skewer stick
2949,You will need to recharge the necklace at the Legends Guild.,11113,True,8080.0,10000.0,20200,12120.0,Skills necklace.png,Skills necklace
2950,This will help me travel.,11105,True,8080.0,10000.0,20200,12120.0,Skills necklace(4).png,Skills necklace(4)
2951,This will help me travel.,11968,True,8080.0,10000.0,20200,12120.0,Skills necklace(6).png,Skills necklace(6)
2952,A blue skirt.,5052,True,250.0,150.0,625,375.0,Skirt (blue).png,Skirt (blue)
2953,A brown skirt. Size small!,5048,True,140.0,150.0,350,210.0,Skirt (brown).png,Skirt (brown)
2954,Lilac skirt.,5050,True,220.0,150.0,550,330.0,Skirt (lilac).png,Skirt (lilac)
2955,A fearsome looking skull.,6163,True,24.0,11000.0,60,36.0,Skull piece.png,Skull piece
2956,Don't make anyone jump when you ring this!,10952,True,60.0,40.0,150,90.0,Slayer bell.png,Slayer bell
2957,The parchment contains a spell invented by Slayer Masters in ancient times.,21257,True,480.0,500.0,1200,720.0,Slayer's enchantment.png,Slayer's enchantment
2958,Ale with bite.,5759,True,1.0,2000.0,2,1.0,Slayer's respite.png,Slayer's respite
2959,This keg contains 4 pints of Slayer's Respite.,5841,True,1.0,2000.0,1,1.0,Slayer's respite(4).png,Slayer's respite(4)
2960,This looks a good deal stronger than normal Slayer's Respite.,5761,True,1.0,2000.0,2,1.0,Slayer's respite(m).png,Slayer's respite(m)
2961,This keg contains 4 pints of mature Slayer's Respite.,5921,True,1.0,2000.0,1,1.0,Slayer's respite(m4).png,Slayer's respite(m4)
2962,An old and magical staff.,4170,True,8400.0,70.0,21000,12600.0,Slayer's staff.png,Slayer's staff
2963,A cap for wearing whilzzzzzzzzzz.,10398,True,800.0,4.0,2000,1200.0,Sleeping cap.png,Sleeping cap
2964,You swear you had more than three slices before.,3162,False,1.0,15.0,2,1.0,Sliced banana.png,Sliced banana
2965,A bowl of sliced Bittercap mushrooms.,7080,True,16.0,13000.0,42,25.0,Sliced mushrooms.png,Sliced mushrooms
2966,You can plant this in your garden.,8441,True,6000.0,10000.0,15000,9000.0,Small box hedge (bagged).png,Small box hedge (bagged)
2967,Useful for catching small fish.,303,False,2.0,40.0,5,3.0,Small fishing net.png,Small fishing net
2968,It gives a 10% accuracy and damage bonus for spells on the standard spellbook.,11998,True,6200.0,8.0,15500,9300.0,Smoke battlestaff.png,Smoke battlestaff
2969,A combined Air and Fire Rune.,4697,True,8.0,12000.0,20,12.0,Smoke rune.png,Smoke rune
2970,A smouldering stone from the depths of Hell.,13233,True,18000.0,5.0,45000,27000.0,Smouldering stone.png,Smouldering stone
2971,Scaly but not slimy! It could be a useful material if it were tanned.,6287,True,14.0,13000.0,35,21.0,Snake hide.png,Snake hide
2972,Scaly but not slimy!,7801,True,14.0,11000.0,35,21.0,Snake hide (swamp).png,Snake hide (swamp)
2973,Nicely tanned skin from a snake.,6289,True,20.0,13000.0,50,30.0,Snakeskin.png,Snakeskin
2974,Lightweight head protection.,6326,True,120.0,125.0,300,180.0,Snakeskin bandana.png,Snakeskin bandana
2975,Made from 100% real snakeskin.,6322,True,500.0,125.0,1250,750.0,Snakeskin body.png,Snakeskin body
2976,Made from snakes.,6328,True,100.0,125.0,250,150.0,Snakeskin boots.png,Snakeskin boots
2977,Made from 100% real snake.,6324,True,470.0,125.0,1175,705.0,Snakeskin chaps.png,Snakeskin chaps
2978,A solid willow shield covered in snakeskin leather.,22272,True,368.0,125.0,920,552.0,Snakeskin shield.png,Snakeskin shield
2979,Made from 100% real snake.,6330,True,173.0,125.0,434,260.0,Snakeskin vambraces.png,Snakeskin vambraces
2980,A powerful herb.,3000,True,23.0,11000.0,59,35.0,Snapdragon.png,Snapdragon
2981,I need another ingredient to finish this Snapdragon potion.,3004,True,23.0,10000.0,59,35.0,Snapdragon potion (unf).png,Snapdragon potion (unf)
2982,A snapdragon seed - plant in a herb patch.,5300,True,24.0,200.0,60,36.0,Snapdragon seed 5.png,Snapdragon seed
2983,Strange spiky grass.,231,True,4.0,13000.0,10,6.0,Snape grass.png,Snape grass
2984,A snape grass seed - plant in an allotment.,22879,True,37.0,200.0,94,56.0,Snape grass seed 5.png,Snape grass seed
2985,There's a snowy knight butterfly in here.,10016,True,20.0,125.0,50,30.0,Snowy knight (item).png,Snowy knight (item)
2986,"It feels clammy, like second-hand toilet paper.",25578,True,68.0,,170,102.0,Soaked page.png,Soaked page
2987,One of the ingredients for making glass.,1781,True,1.0,13000.0,2,1.0,Soda ash.png,Soda ash
2988,Clay soft enough to mould.,1761,False,1.0,13000.0,2,1.0,Soft clay.png,Soft clay
2989,Used for high level curse spells.,566,True,120.0,10000.0,300,180.0,Soul rune.png,Soul rune
2990,A slightly muddy spade.,952,False,1.0,40.0,3,1.0,Spade.png,Spade
2991,A large spatula... of doom!,7439,True,768.0,50.0,1920,1152.0,Spatula.png,Spatula
2992,A sigil in the shape of a spectral symbol.,12823,True,300000.0,5.0,750000,450000.0,Spectral sigil.png,Spectral sigil
2993,An ethereal shield with a spectral sigil attached to it.,12821,True,800000.0,8.0,2000000,1200000.0,Spectral spirit shield.png,Spectral spirit shield
2994,This could liven up an otherwise bland stew.,2007,True,92.0,11000.0,230,138.0,Spice.png,Spice
2995,Yum... smells spicy.,2213,True,1.0,6000.0,2,1.0,Spicy crunchies.png,Spicy crunchies
2996,A bowl of fiery minced meat.,9996,True,3.0,8000.0,8,4.0,Spicy minced meat.png,Spicy minced meat
2997,A bowl of spicy sauce.,7072,True,3.0,13000.0,9,5.0,Spicy sauce.png,Spicy sauce
2998,A bowl of chopped tomatoes with an extra kick.,9994,True,1.0,8000.0,3,1.0,Spicy tomato.png,Spicy tomato
2999,Its creeping days are over!,6291,True,6.0,13000.0,15,9.0,Spider carcass.png,Spider carcass
3000,A nicely roasted spider threaded onto an arrow shaft.,6299,True,16.0,6000.0,40,24.0,Spider on shaft.png,Spider on shaft
3001,A nicely roasted spider threaded onto a skewer stick.,6297,True,20.0,6000.0,50,30.0,Spider on stick.png,Spider on stick
3002,Climbing boots with spikes.,3107,True,12.0,15.0,30,18.0,Spiked boots.png,Spiked boots
3003,"Some very spikey metal bands, better make sure I don't cut myself while walking.",23389,True,1000.0,8.0,2500,1500.0,Spiked manacles.png,Spiked manacles
3004,Attack at your own risk.,10077,True,64.0,125.0,160,96.0,Spiky vambraces.png,Spiky vambraces
3005,A home made spinach thing.,1969,False,1.0,50.0,1,1.0,Spinach roll.png,Spinach roll
3006,A constant reminder that I'm above a Dagannoth in the food chain.,6133,True,3120.0,70.0,7800,4680.0,Spined body.png,Spined body
3007,"Some finely crafted Fremennik boots, made from spined dagannoth hide.",6143,True,260.0,125.0,650,390.0,Spined boots.png,Spined boots
3008,Stylish leg armour for rangers with a lingering smell of raw fish...,6135,True,1560.0,70.0,3900,2340.0,Spined chaps.png,Spined chaps
3009,Fremennik gloves stitched together from spined dagannoth hide.,6149,True,260.0,125.0,650,390.0,Spined gloves.png,Spined gloves
3010,A helm fit for any Fremennik ranger.,6131,True,24000.0,70.0,60000,36000.0,Spined helm.png,Spined helm
3011,You don't want to wear it inside-out.,4551,True,260.0,125.0,650,390.0,Spiny helmet.png,Spiny helmet
3012,An ethereal shield.,12829,True,28000.0,8.0,70000,42000.0,Spirit shield.png,Spirit shield
3013,Used to repair bridges.,10812,True,36.0,11000.0,90,54.0,Split log.png,Split log
3014,Provides good protection.,3387,True,18000.0,70.0,45000,27000.0,Splitbark body.png,Splitbark body
3015,Wooden foot protection.,3393,True,2000.0,70.0,5000,3000.0,Splitbark boots.png,Splitbark boots
3016,These should keep my hands safe.,3391,True,2000.0,70.0,5000,3000.0,Splitbark gauntlets.png,Splitbark gauntlets
3017,A wooden helmet.,3385,True,4000.0,70.0,10000,6000.0,Splitbark helm.png,Splitbark helm
3018,These should protect my legs.,3389,True,16000.0,70.0,40000,24000.0,Splitbark legs.png,Splitbark legs
3019,Use the spork.,7437,True,130.0,50.0,325,195.0,Spork.png,Spork
3020,A surprisingly aerodynamic cape.,10069,True,160.0,125.0,400,240.0,Spotted cape.png,Spotted cape
3021,Maybe this is why people think furry dice make you go faster.,10125,True,60.0,10000.0,150,90.0,Spotted kebbit fur.png,Spotted kebbit fur
3022,A really surprisingly aerodynamic cape.,10071,True,320.0,125.0,800,480.0,Spottier cape.png,Spottier cape
3023,It's a slightly magical stick.,1379,False,6.0,125.0,15,9.0,Staff.png,Staff
3024,A Magical staff.,1381,False,600.0,125.0,1500,900.0,Staff of air.png,Staff of air
3025,A ghastly weapon with evil origins combined with an icon of balance.,24144,True,1.0,,1,1.0,Staff of balance.png,Staff of balance
3026,A staff styled after the elusive cat.,23363,True,600.0,8.0,1500,900.0,Staff of bob the cat.png,Staff of bob the cat
3027,A Magical staff.,1385,False,600.0,125.0,1500,900.0,Staff of earth.png,Staff of earth
3028,A Magical staff.,1387,False,600.0,125.0,1500,900.0,Staff of fire.png,Staff of fire
3029,A ghastly weapon with evil origins combined with a holy light.,22296,True,400002.0,8.0,1000005,600003.0,Staff of light.png,Staff of light
3030,A ghastly weapon with evil origins.,11791,True,400002.0,8.0,1000005,600003.0,Staff of the dead.png,Staff of the dead
3031,A Magical staff.,1383,False,600.0,125.0,1500,900.0,Staff of water.png,Staff of water
3032,Baguette ready for pain.,20590,False,90.0,5.0,225,135.0,Stale baguette.png,Stale baguette
3033,One dose of fishy stamina potion.,12635,True,36.0,2000.0,90,54.0,Stamina mix(1).png,Stamina mix(1)
3034,Two doses of fishy stamina potion.,12633,True,64.0,2000.0,160,96.0,Stamina mix(2).png,Stamina mix(2)
3035,1 dose of stamina potion.,12631,True,40.0,2000.0,100,60.0,Stamina potion(1).png,Stamina potion(1)
3036,2 doses of stamina potion.,12629,True,80.0,2000.0,200,120.0,Stamina potion(2).png,Stamina potion(2)
3037,3 doses of stamina potion.,12627,True,120.0,2000.0,300,180.0,Stamina potion(3).png,Stamina potion(3)
3038,4 doses of stamina potion.,12625,True,160.0,2000.0,400,240.0,Stamina potion(4).png,Stamina potion(4)
3039,A powerful warhammer.,22622,True,120000.0,10.0,300000,180000.0,Statius's warhammer.png,Statius's warhammer
3040,It's a slightly magical stick.,11787,True,6800.0,8.0,17000,10200.0,Steam battlestaff.png,Steam battlestaff
3041,A combined Water and Fire Rune.,4694,True,8.0,12000.0,20,12.0,Steam rune.png,Steam rune
3042,Makes a steam battlestaff or mystic steam staff more beautiful.,12798,True,600.0,50.0,1500,900.0,Steam staff upgrade kit.png,Steam staff upgrade kit
3043,A two handed sword.,1311,False,400.0,125.0,1000,600.0,Steel 2h sword.png,Steel 2h sword
3044,Arrows with steel heads.,886,False,4.0,7000.0,12,7.0,Steel arrow 5.png,Steel arrow
3045,Venomous-looking arrows.,887,True,4.0,7000.0,12,7.0,Steel arrow(p) 5.png,Steel arrow(p)
3046,Venomous-looking arrows.,5618,True,4.0,7000.0,12,7.0,Steel arrow(p+) 5.png,Steel arrow(p+)
3047,Venomous-looking arrows.,5624,True,4.0,7000.0,12,7.0,Steel arrow(p++) 5.png,Steel arrow(p++)
3048,I can make some arrows with these.,41,True,2.0,10000.0,6,3.0,Steel arrowtips.png,Steel arrowtips
3049,A woodcutter's axe.,1353,False,80.0,40.0,200,120.0,Steel axe.png,Steel axe
3050,It's a bar of steel.,2353,False,40.0,10000.0,100,60.0,Steel bar.png,Steel bar
3051,A vicious looking axe.,1365,False,260.0,125.0,650,390.0,Steel battleaxe.png,Steel battleaxe
3052,Steel crossbow bolts.,9141,True,3.0,7000.0,8,4.0,Steel bolts 5.png,Steel bolts
3053,Some poisoned steel bolts.,9288,True,3.0,11000.0,8,4.0,Steel bolts (p) 5.png,Steel bolts (p)
3054,Some poisoned steel bolts.,9295,True,3.0,11000.0,8,4.0,Steel bolts (p+) 5.png,Steel bolts (p+)
3055,Super poisoned steel bolts.,9302,True,3.0,11000.0,8,4.0,Steel bolts (p++) 5.png,Steel bolts (p++)
3056,Unfeathered steel crossbow bolts.,9378,True,1.0,13000.0,1,1.0,Steel bolts (unf) 5.png,Steel bolts (unf)
3057,These will protect my feet.,4123,True,120.0,125.0,300,180.0,Steel boots.png,Steel boots
3058,Blunt steel arrow... ouch.,4783,True,8.0,11000.0,20,12.0,Steel brutal 5.png,Steel brutal
3059,A series of connected metal rings.,1105,False,300.0,125.0,750,450.0,Steel chainbody.png,Steel chainbody
3060,A set of fighting claws.,3097,True,70.0,125.0,175,105.0,Steel claws.png,Steel claws
3061,A steel crossbow.,9179,True,144.0,125.0,360,216.0,Steel crossbow.png,Steel crossbow
3062,An unstrung steel crossbow.,9459,True,130.0,10000.0,327,196.0,Steel crossbow (u).png,Steel crossbow (u)
3063,Short but pointy.,1207,False,50.0,125.0,125,75.0,Steel dagger.png,Steel dagger
3064,The blade has been poisoned.,1223,True,50.0,125.0,125,75.0,Steel dagger(p).png,Steel dagger(p)
3065,The blade has been poisoned.,5672,True,50.0,125.0,125,75.0,Steel dagger(p+).png,Steel dagger(p+)
3066,The blade has been poisoned.,5690,True,50.0,125.0,125,75.0,Steel dagger(p++).png,Steel dagger(p++)
3067,A deadly throwing dart with a steel tip.,808,True,4.0,7000.0,10,6.0,Steel dart.png,Steel dart
