,examine,id,members,lowalch,limit,value,highalch,icon,name
1866,They're a gnome delicacy apparently.,2162,True,1.0,13000.0,2,1.0,King worm.png,King worm
1867,"A sharp, dependable knife, for filleting meat.",7447,True,3200.0,50.0,8000,4800.0,Kitchen knife.png,Kitchen knife
1868,How does it all fit in there?,8528,True,4.0,500.0,10,6.0,Kitchen table (flatpack).png,Kitchen table (flatpack)
1869,A dangerous looking knife.,946,False,2.0,40.0,6,3.0,Knife.png,Knife
1870,"An insignia representing Kodai, Xeric's fearsome wizards.",21043,True,60000.0,8.0,150000,90000.0,Kodai insignia.png,Kodai insignia
1871,A wand of an ancient Kodai mage.,21006,True,60000.0,8.0,150000,90000.0,Kodai wand.png,Kodai wand
1872,Ewwww... it's still sucky.,12004,True,33336.0,70.0,83340,50004.0,Kraken tentacle.png,Kraken tentacle
1873,A handful of Krandorian Hops.,6000,True,4.0,11000.0,10,6.0,Krandorian hops.png,Krandorian hops
1874,A Krandorian hop seed - plant in a hops patch.,5310,True,3.0,2000.0,8,4.0,Krandorian seed 5.png,Krandorian seed
1875,A powerful herb.,263,True,21.0,13000.0,54,32.0,Kwuarm.png,Kwuarm
1876,I need another ingredient to finish this Kwuarm potion.,105,True,21.0,10000.0,54,32.0,Kwuarm potion (unf).png,Kwuarm potion (unf)
1877,A kwuarm seed - plant in a herb patch.,5299,True,4.0,200.0,11,6.0,Kwuarm seed 5.png,Kwuarm seed
1878,It's a perfect-looking kyatt fur.,10103,True,64.0,10000.0,160,96.0,Kyatt fur.png,Kyatt fur
1879,This should make me harder to spot in polar areas.,10039,True,400.0,150.0,1000,600.0,Kyatt hat.png,Kyatt hat
1880,These should make me harder to spot in polar areas.,10035,True,80.0,150.0,200,120.0,Kyatt legs.png,Kyatt legs
1881,This should make me harder to spot in polar areas.,10037,True,80.0,150.0,200,120.0,Kyatt top.png,Kyatt top
1882,A powerful herb.,2481,True,27.0,11000.0,68,40.0,Lantadyme.png,Lantadyme
1883,I need another ingredient to finish this Lantadyme potion.,2483,True,27.0,10000.0,68,40.0,Lantadyme potion (unf).png,Lantadyme potion (unf)
1884,A lantadyme seed - plant in a herb patch.,5302,True,3.0,200.0,9,5.0,Lantadyme seed 5.png,Lantadyme seed
1885,A roughly circular disc of glass.,4542,True,28.0,10000.0,70,42.0,Lantern lens.png,Lantern lens
1886,How does it all fit in there?,8580,True,4.0,500.0,10,6.0,Large oak bed (flatpack).png,Large oak bed (flatpack)
1887,How does it all fit in there?,8584,True,4.0,500.0,10,6.0,Large teak bed (flatpack).png,Large teak bed (flatpack)
1888,It's a perfect-looking larupia fur.,10095,True,32.0,10000.0,80,48.0,Larupia fur.png,Larupia fur
1889,This should make me harder to spot in woodland and jungle areas.,10045,True,200.0,150.0,500,300.0,Larupia hat.png,Larupia hat
1890,These should make me harder to spot in woodland and jungle areas.,10041,True,40.0,150.0,100,60.0,Larupia legs.png,Larupia legs
1891,This should make me harder to spot in woodland and jungle areas.,10043,True,40.0,150.0,100,60.0,Larupia top.png,Larupia top
1892,A teleport to Lassar.,12780,True,1.0,10000.0,1,1.0,Lassar teleport (tablet).png,Lassar teleport (tablet)
1893,It's a slightly magical stick.,3053,True,6800.0,8.0,17000,10200.0,Lava battlestaff.png,Lava battlestaff
1894,Bones of a lava dragon.,11943,True,60.0,7500.0,150,90.0,Lava dragon bones.png,Lava dragon bones
1895,Do I look scary?,12371,True,4000.0,4.0,10000,6000.0,Lava dragon mask.png,Lava dragon mask
1896,A combined Earth and Fire Rune.,4699,True,8.0,12000.0,20,12.0,Lava rune.png,Lava rune
1897,A scale from the hide of a lava dragon.,11992,True,20.0,11000.0,50,30.0,Lava scale.png,Lava scale
1898,Ground-up lava dragon scale.,11994,True,8.0,11000.0,20,12.0,Lava scale shard 5.png,Lava scale shard
1899,Makes a lava battlestaff or mystic lava staff more beautiful.,21202,True,600.0,50.0,1500,900.0,Lava staff upgrade kit.png,Lava staff upgrade kit
1900,Used for teleport spells.,563,False,96.0,12000.0,240,144.0,Law rune.png,Law rune
1901,A razor-sharp battleaxe.,20727,True,38400.0,70.0,96000,57600.0,Leaf-bladed battleaxe.png,Leaf-bladed battleaxe
1902,A razor-sharp sword.,11902,True,27200.0,70.0,68000,40800.0,Leaf-bladed sword.png,Leaf-bladed sword
1903,"The lean, slimy corpse of a deceased giant snail.",3365,True,4.0,13000.0,10,6.0,Lean snail.png,Lean snail
1904,A succulently slimy slice of sumptuous snail.,3371,True,8.0,6000.0,20,12.0,Lean snail meat.png,Lean snail meat
1905,Some non-tasty salmon.,11330,True,1.0,13000.0,3,1.0,Leaping salmon.png,Leaping salmon
1906,A bloated sturgeon.,11332,True,1.0,13000.0,4,2.0,Leaping sturgeon.png,Leaping sturgeon
1907,A sad-looking trout.,11328,True,1.0,13000.0,2,1.0,Leaping trout.png,Leaping trout
1908,It's a piece of leather.,1741,False,1.0,13000.0,1,1.0,Leather.png,Leather
1909,Better than no armour!,1129,False,8.0,125.0,21,12.0,Leather body.png,Leather body
1910,Better than no armour! Nice trim too!,23381,False,340.0,8.0,850,510.0,Leather body (g).png,Leather body (g)
1911,Comfortable leather boots.,1061,False,2.0,125.0,6,3.0,Leather boots.png,Leather boots
1912,Better than no armour!,1095,False,8.0,125.0,20,12.0,Leather chaps.png,Leather chaps
1913,Better than no armour! Nice trim too!,23384,False,340.0,8.0,850,510.0,Leather chaps (g).png,Leather chaps (g)
1914,Better than no armour!,1167,False,9.0,125.0,24,14.0,Leather cowl.png,Leather cowl
1915,These will keep my hands warm!,1059,False,2.0,125.0,6,3.0,Leather gloves.png,Leather gloves
1916,Better than no armour!,1063,False,7.0,125.0,18,10.0,Leather vambraces.png,Leather vambraces
1917,A black piece of cloth on a string.,19724,True,1.0,4.0,2,1.0,Left eye patch.png,Left eye patch
1918,A fresh lemon.,2102,True,1.0,13000.0,2,1.0,Lemon.png,Lemon
1919,Fresh chunks of lemon.,2104,True,1.0,13000.0,2,1.0,Lemon chunks.png,Lemon chunks
1920,Fresh lemon slices.,2106,True,1.0,13000.0,2,1.0,Lemon slices.png,Lemon slices
1921,Top o' the morning!,12359,True,400.0,4.0,1000,600.0,Leprechaun hat.png,Leprechaun hat
1922,Evil.,20020,True,1600.0,4.0,4000,2400.0,Lesser demon mask.png,Lesser demon mask
1923,A weapon forged from the wreckage of an airship.,19478,True,50000.0,8.0,125000,75000.0,Light ballista.png,Light ballista
1924,Bow ties are cool.,19985,True,2000.0,4.0,5000,3000.0,Light bow tie.png,Light bow tie
1925,A light wooden frame.,19586,True,20000.0,8.0,50000,30000.0,Light frame.png,Light frame
1926,Use on infinity pieces to recolour them!,12530,True,2000.0,4.0,5000,3000.0,Light infinity colour kit.png,Light infinity colour kit
1927,A component of cave goblin Magic.,10973,True,140.0,10000.0,350,210.0,Light orb.png,Light orb
1928,Light tuxedo trousers with matching stockings.,19979,True,2400.0,4.0,6000,3600.0,Light trousers.png,Light trousers
1929,Linked tuxedo cuffs with a gold trim.,19976,True,1200.0,4.0,3000,1800.0,Light tuxedo cuffs.png,Light tuxedo cuffs
1930,A light tuxedo jacket with a matching shirt.,19973,True,4000.0,4.0,10000,6000.0,Light tuxedo jacket.png,Light tuxedo jacket
1931,Light shoes to match your light tuxedo.,19982,True,1200.0,4.0,3000,1800.0,Light tuxedo shoes.png,Light tuxedo shoes
1932,A fresh lime.,2120,True,1.0,13000.0,2,1.0,Lime.png,Lime
1933,Fresh chunks of lime.,2122,True,1.0,13000.0,1,1.0,Lime chunks.png,Lime chunks
1934,Fresh lime slices.,2124,True,1.0,13000.0,2,1.0,Lime slices.png,Lime slices
1935,Some limestone.,3211,True,4.0,13000.0,10,6.0,Limestone.png,Limestone
1936,A well carved limestone brick.,3420,True,8.0,10000.0,20,12.0,Limestone brick.png,Limestone brick
1937,The root of a limpwurt plant.,225,False,2.0,13000.0,7,4.0,Limpwurt root.png,Limpwurt root
1938,A limpwurt seed - plant in a flower patch.,5100,True,4.0,600.0,12,7.0,Limpwurt seed 5.png,Limpwurt seed
1939,One sheet of mummy wrap.,4684,True,12.0,15.0,30,18.0,Linen.png,Linen
1940,Ripped from the maw of a dying lizardman of Kourend.,13391,True,24.0,13000.0,60,36.0,Lizardman fang.png,Lizardman fang
1941,The remains of a deadly shade.,3396,True,1.0,7500.0,1,1.0,Loar remains.png,Loar remains
1942,This looks tricky to eat.,379,False,28.0,6000.0,70,42.0,Lobster.png,Lobster
1943,Useful for catching lobsters.,301,False,8.0,40.0,20,12.0,Lobster pot.png,Lobster pot
1944,For picking tough locks.,1523,True,8.0,250.0,20,12.0,Lockpick.png,Lockpick
1945,"Delicious and nutritious. Well, nutritious anyway.",9052,True,1.0,6000.0,1,1.0,Locust meat.png,Locust meat
1946,A number of wooden logs.,1511,False,1.0,15000.0,4,2.0,Logs.png,Logs
1947,Bolts made from the spikes of a razor-backed kebbit.,10159,True,12.0,11000.0,31,18.0,Long kebbit bolts.png,Long kebbit bolts
1948,These bone spikes are both very tough and very sharp.,10107,True,60.0,10000.0,150,90.0,Long kebbit spike.png,Long kebbit spike
1949,A nice sturdy bow.,839,False,32.0,18000.0,80,48.0,Longbow.png,Longbow
1950,I need to find a string for this.,48,True,24.0,10000.0,60,36.0,Longbow (u).png,Longbow (u)
1951,The loop end of the mysterious Crystal Key. Can you find the other half?,987,True,40.0,11000.0,100,60.0,Loop half of key.png,Loop half of key
1952,A note that may be exchanged at a bank for a Looting Bag.,24585,True,36.0,40.0,90,54.0,Looting bag note.png,Looting bag note
1953,A lovakite banner baring the sigil of house Lovakengj.,20257,True,28.0,4.0,70,42.0,Lovakengj banner.png,Lovakengj banner
1954,A rare hood from Lovakengj .,20119,True,1.0,4.0,1,1.0,Lovakengj hood.png,Lovakengj hood
1955,A yellow scarf adorned with an ornamental anvil.,19949,True,4000.0,4.0,10000,6000.0,Lovakengj scarf.png,Lovakengj scarf
1956,Teleports you to the Lumberyard.,12642,True,4.0,10000.0,10,6.0,Lumberyard teleport.png,Lumberyard teleport
1957,A teleport to Lumbridge graveyard.,19613,True,1.0,10000.0,1,1.0,Lumbridge graveyard teleport (tablet).png,Lumbridge graveyard teleport (tablet)
1958,A teleport to Lumbridge.,8008,True,1.0,10000.0,1,1.0,Lumbridge teleport (tablet).png,Lumbridge teleport (tablet)
1959,Teleports you to Lunar isle.,12405,True,4.0,10000.0,10,6.0,Lunar isle teleport.png,Lunar isle teleport
1960,Mahogany treasure chest.,9864,True,4.0,500.0,10,6.0,M. treasure chest (flatpack).png,M. treasure chest (flatpack)
1961,A jungle specific slashing device.,975,True,16.0,15.0,40,24.0,Machete.png,Machete
1962,Some nicely cooked mackerel.,355,True,6.0,6000.0,15,9.0,Mackerel.png,Mackerel
1963,The magical book of the Mage.,6889,True,200.0,15.0,500,300.0,Mage's book.png,Mage's book
1964,Feed and catch the birds by placing this in the right spot.,22201,True,2.0,250.0,5,3.0,Magic bird house.png,Magic bird house
1965,A magical catching box.,10025,True,240.0,250.0,600,360.0,Magic box.png,Magic box
1966,How does it all fit in there?,9848,True,4.0,500.0,10,6.0,Magic cape rack (flatpack).png,Magic cape rack (flatpack)
1967,A powerful bow made from magic wood.,10284,True,1000.0,8.0,2500,1500.0,Magic comp bow.png,Magic comp bow
1968,One dose of fishy Magic essence.,11491,True,52.0,2000.0,130,78.0,Magic essence mix(1).png,Magic essence mix(1)
1969,Two doses of fishy Magic essence.,11489,True,72.0,2000.0,180,108.0,Magic essence mix(2).png,Magic essence mix(2)
1970,This can be attached to a Staff of the Dead or a Trident of the Seas.,12932,True,40800.0,5.0,102000,61200.0,Magic fang.png,Magic fang
1971,Logs cut from a magic tree.,1513,True,128.0,12000.0,320,192.0,Magic logs.png,Magic logs
1972,A nice sturdy magical bow.,859,True,1024.0,18000.0,2560,1536.0,Magic longbow.png,Magic longbow
1973,An unstrung magic longbow; I need a bowstring for this.,70,True,512.0,10000.0,1280,768.0,Magic longbow (u).png,Magic longbow (u)
1974,One dose of fishy Magic potion.,11515,True,60.0,2000.0,150,90.0,Magic mix(1).png,Magic mix(1)
1975,Two doses of fishy Magic potion.,11513,True,80.0,2000.0,200,120.0,Magic mix(2).png,Magic mix(2)
1976,1 dose of Magic potion.,3046,True,60.0,2000.0,150,90.0,Magic potion(1).png,Magic potion(1)
1977,2 doses of Magic potion.,3044,True,80.0,2000.0,200,120.0,Magic potion(2).png,Magic potion(2)
1978,3 doses of Magic potion.,3042,True,100.0,2000.0,250,150.0,Magic potion(3).png,Magic potion(3)
1979,4 doses of Magic potion.,3040,True,120.0,2000.0,300,180.0,Magic potion(4).png,Magic potion(4)
1980,Magic logs prepared with sacred oil for a funeral pyre.,3448,True,256.0,11000.0,640,384.0,Magic pyre logs.png,Magic pyre logs
1981,The roots of the Magic tree.,6051,True,1.0,11000.0,1,1.0,Magic roots.png,Magic roots
1982,This sapling is ready to be replanted in a tree patch.,5374,True,1.0,200.0,1,1.0,Magic sapling.png,Magic sapling
1983,Plant this in a plantpot of soil to grow a sapling.,5316,True,168.0,200.0,422,253.0,Magic seed 5.png,Magic seed
1984,A solid magic wood shield.,22263,True,512.0,125.0,1280,768.0,Magic shield.png,Magic shield
1985,"Short and magical, but still effective.",861,True,640.0,18000.0,1600,960.0,Magic shortbow.png,Magic shortbow
1986,An unstrung magic shortbow; I need a bowstring for this.,72,True,320.0,10000.0,800,480.0,Magic shortbow (u).png,Magic shortbow (u)
1987,Use on a Magic shortbow to imbue the bow.,12786,True,2000.0,10000.0,5000,3000.0,Magic shortbow scroll.png,Magic shortbow scroll
1988,A Magical staff.,1389,False,80.0,125.0,200,120.0,Magic staff.png,Magic staff
1989,A magic crossbow stock.,21952,True,112.0,10000.0,280,168.0,Magic stock.png,Magic stock
1990,A magic stone to make high-level furniture.,8788,True,300000.0,11000.0,750000,450000.0,Magic stone.png,Magic stone
1991,I could use this to make jewellery.,6038,True,1.0,11000.0,1,1.0,Magic string.png,Magic string
1992,Magpie impling in a jar.,11252,True,20.0,18000.0,50,30.0,Magpie impling jar.png,Magpie impling jar
1993,How does it all fit in there?,8508,True,4.0,500.0,10,6.0,Mahogany armchair (flatpack).png,Mahogany armchair (flatpack)
1994,Mahogany armour case.,9861,True,4.0,500.0,10,6.0,Mahogany armour case (flatpack).png,Mahogany armour case (flatpack)
1995,How does it all fit in there?,8572,True,4.0,500.0,10,6.0,Mahogany bench (flatpack).png,Mahogany bench (flatpack)
1996,Feed and catch the birds by placing this in the right spot.,22195,True,2.0,250.0,5,3.0,Mahogany bird house.png,Mahogany bird house
1997,How does it all fit in there?,8514,True,4.0,500.0,10,6.0,Mahogany bookcase (flatpack).png,Mahogany bookcase (flatpack)
1998,How does it all fit in there?,9845,True,4.0,500.0,10,6.0,Mahogany cape rack (flatpack).png,Mahogany cape rack (flatpack)
1999,How does it all fit in there?,8606,True,4.0,500.0,10,6.0,Mahogany dresser (flatpack).png,Mahogany dresser (flatpack)
2000,Mahogany fancy dress box.,9867,True,4.0,500.0,10,6.0,Mahogany fancy dress box (flatpack).png,Mahogany fancy dress box (flatpack)
2001,Some well-cut mahogany logs.,6332,True,20.0,11000.0,50,30.0,Mahogany logs.png,Mahogany logs
2002,Mahogany magic wardrobe.,9856,True,4.0,500.0,10,6.0,Mahogany magic wardrobe (flatpack).png,Mahogany magic wardrobe (flatpack)
2003,A plank of expensive mahogany.,8782,True,600.0,13000.0,1500,900.0,Mahogany plank.png,Mahogany plank
2004,Mahogany logs prepared with sacred oil for a funeral pyre.,6213,True,80.0,11000.0,200,120.0,Mahogany pyre logs.png,Mahogany pyre logs
2005,This sapling is ready to be replanted in a tree patch.,21480,True,1.0,200.0,1,1.0,Mahogany sapling.png,Mahogany sapling
2006,Plant this in a plantpot of soil to grow a sapling.,21488,True,19.0,200.0,48,28.0,Mahogany seed 5.png,Mahogany seed
2007,A mahogany crossbow stock.,9450,True,53.0,10000.0,133,79.0,Mahogany stock.png,Mahogany stock
2008,How does it all fit in there?,8558,True,4.0,500.0,10,6.0,Mahogany table (flatpack).png,Mahogany table (flatpack)
2009,How does it all fit in there?,9851,True,4.0,500.0,10,6.0,Mahogany toy box (flatpack).png,Mahogany toy box (flatpack)
2010,How does it all fit in there?,8620,True,4.0,500.0,10,6.0,Mahogany wardrobe (flatpack).png,Mahogany wardrobe (flatpack)
2011,A broken shield piece.,11931,True,12400.0,10000.0,31000,18600.0,Malediction shard 1.png,Malediction shard 1
2012,A broken shield piece.,11932,True,12400.0,10000.0,31000,18600.0,Malediction shard 2.png,Malediction shard 2
2013,A broken shield piece.,11933,True,12400.0,10000.0,31000,18600.0,Malediction shard 3.png,Malediction shard 3
2014,"An ancient, evil shield forged by Volcanic heat.",11924,True,18000.0,8.0,45000,27000.0,Malediction ward.png,Malediction ward
2015,A rare catch.,391,True,80.0,10000.0,200,120.0,Manta ray.png,Manta ray
2016,Feed and catch the birds by placing this in the right spot.,22192,True,2.0,250.0,5,3.0,Maple bird house.png,Maple bird house
2017,A solid bit of maple.,6416,True,480.0,125.0,1200,720.0,Maple blackjack.png,Maple blackjack
2018,A defensive blackjack.,6420,True,640.0,125.0,1600,960.0,Maple blackjack(d).png,Maple blackjack(d)
2019,An offensive blackjack.,6418,True,640.0,125.0,1600,960.0,Maple blackjack(o).png,Maple blackjack(o)
2020,Logs cut from a maple tree.,1517,False,32.0,15000.0,80,48.0,Maple logs.png,Maple logs
2021,A nice sturdy bow made out of Maple.,851,False,256.0,18000.0,640,384.0,Maple longbow.png,Maple longbow
2022,An unstrung maple longbow; I need a bowstring for this.,62,True,128.0,10000.0,320,192.0,Maple longbow (u).png,Maple longbow (u)
2023,Maple logs prepared with sacred oil for a funeral pyre.,3444,True,64.0,11000.0,160,96.0,Maple pyre logs.png,Maple pyre logs
2024,The roots of the Maple tree.,6047,True,1.0,11000.0,1,1.0,Maple roots.png,Maple roots
2025,This sapling is ready to be replanted in a tree patch.,5372,True,1.0,200.0,1,1.0,Maple sapling.png,Maple sapling
2026,Plant this in a plantpot of soil to grow a sapling.,5314,True,19.0,200.0,48,28.0,Maple seed 5.png,Maple seed
2027,A solid maple shield.,22257,True,128.0,125.0,320,192.0,Maple shield.png,Maple shield
2028,"A shortbow made out of Maple, still effective.",853,False,160.0,18000.0,400,240.0,Maple shortbow.png,Maple shortbow
2029,An unstrung maple shortbow; I need a bowstring for this.,64,True,80.0,10000.0,200,120.0,Maple shortbow (u).png,Maple shortbow (u)
2030,A maple crossbow stock.,9448,True,40.0,10000.0,100,60.0,Maple stock.png,Maple stock
2031,A beautifully carved marble block.,8786,True,100000.0,11000.0,250000,150000.0,Marble block.png,Marble block
2032,How does it all fit in there?,9847,True,4.0,500.0,10,6.0,Marble cape rack (flatpack).png,Marble cape rack (flatpack)
2033,Marble magic wardrobe.,9858,True,4.0,500.0,10,6.0,Marble magic wardrobe (flatpack).png,Marble magic wardrobe (flatpack)
2034,A marigold seed - plant in a flower patch.,5096,True,1.0,600.0,2,1.0,Marigold seed 5.png,Marigold seed
2035,A bunch of marigolds.,6010,True,1.0,600.0,1,1.0,Marigolds.png,Marigolds
2036,A herb used in poison cures.,251,True,2.0,13000.0,5,3.0,Marrentill.png,Marrentill
2037,I need another ingredient to finish this Marrentill potion.,93,True,2.0,10000.0,5,3.0,Marrentill potion (unf).png,Marrentill potion (unf)
2038,A marrentill seed - plant in a herb patch.,5292,True,1.0,600.0,2,1.0,Marrentill seed 5.png,Marrentill seed
2039,"A thick, foul-smelling, tar-like substance with an orange tinge.",10143,True,1.0,7000.0,1,1.0,Marrentill tar.png,Marrentill tar
2040,A creepy mask worn during a blood moon.,23522,True,2000.0,70.0,5000,3000.0,Mask of ranul.png,Mask of ranul
2041,I can store my teleport scrolls in this.,21387,True,2000.0,100.0,5000,3000.0,Master scroll book (empty).png,Master scroll book (empty)
2042,A master level wand.,6914,True,40000.0,70.0,100001,60000.0,Master wand.png,Master wand
2043,This looks a good deal stronger than normal cider.,5765,True,1.0,2000.0,2,1.0,Mature cider.png,Mature cider
2044,This looks a good deal stronger than normal Wizards Mind Bomb.,5741,True,1.0,2000.0,2,1.0,Mature wmb.png,Mature wmb
2045,Not for vegetarians.,2327,False,6.0,10000.0,15,9.0,Meat pie.png,Meat pie
2046,A pizza with bits of meat on it.,2293,False,20.0,10000.0,50,30.0,Meat pizza.png,Meat pizza
2047,Often used to soften tough meat up.,7449,True,16600.0,50.0,41500,24900.0,Meat tenderiser.png,Meat tenderiser
2048,Good for keeping the sun off my neck.,6392,True,14.0,150.0,35,21.0,Menaphite purple hat.png,Menaphite purple hat
2049,Look at those nobbily knees.,6398,True,8.0,150.0,20,12.0,Menaphite purple kilt.png,Menaphite purple kilt
2050,A cool light Menaphite robe.,6396,True,16.0,150.0,40,24.0,Menaphite purple robe.png,Menaphite purple robe
2051,Colourful.,6394,True,8.0,150.0,20,12.0,Menaphite purple top.png,Menaphite purple top
2052,Good for keeping the sun off my neck.,6400,True,14.0,150.0,35,21.0,Menaphite red hat.png,Menaphite red hat
2053,Look at those nobbily knees.,6406,True,8.0,150.0,20,12.0,Menaphite red kilt.png,Menaphite red kilt
2054,A cool light Menaphite robe.,6404,True,16.0,150.0,40,24.0,Menaphite red robe.png,Menaphite red robe
2055,Colourful.,6402,True,8.0,150.0,20,12.0,Menaphite red top.png,Menaphite red top
2056,An iron tipped trident.,21649,True,160.0,125.0,400,240.0,Merfolk trident.png,Merfolk trident
2057,A bowl of finely minced meat.,7070,True,3.0,13000.0,8,4.0,Minced meat.png,Minced meat
2058,A teleport to the Mind Altar.,19617,True,1.0,10000.0,1,1.0,Mind altar teleport (tablet).png,Mind altar teleport (tablet)
2059,This keg contains 4 pints of Wizards Mind Bomb.,5801,True,1.0,2000.0,1,1.0,Mind bomb(4).png,Mind bomb(4)
2060,This keg contains 4 pints of mature Wizards Mind Bomb.,5881,True,1.0,2000.0,1,1.0,Mind bomb(m4).png,Mind bomb(m4)
2061,A magic helmet.,9733,True,1200.0,70.0,3000,1800.0,Mind helmet.png,Mind helmet
2062,Used for basic level missile spells.,558,False,1.0,12000.0,3,1.0,Mind rune.png,Mind rune
2063,A magic shield.,9731,True,1200.0,70.0,3000,1800.0,Mind shield.png,Mind shield
2064,A mysterious power emanates from the talisman...,1448,False,1.0,11000.0,4,2.0,Mind talisman.png,Mind talisman
2065,A tiara infused with the properties of the mind.,5529,False,40.0,40.0,100,60.0,Mind tiara.png,Mind tiara
2066,A helmet with an unlit lamp on it.,5014,True,240.0,4.0,600,360.0,Mining helmet.png,Mining helmet
2067,It looks very minty.,9475,True,100.0,10000.0,250,150.0,Mint cake.png,Mint cake
2068,I can just about see things in this shield's reflection.,4156,True,2000.0,40.0,5000,3000.0,Mirror shield.png,Mirror shield
2069,It's a slightly magical stick.,20730,True,6200.0,8.0,15500,9300.0,Mist battlestaff.png,Mist battlestaff
2070,A combined Air and Water Rune.,4695,True,8.0,12000.0,20,12.0,Mist rune.png,Mist rune
2071,A mithril grapple tipped bolt - needs a rope.,9419,True,1.0,11000.0,1,1.0,Mith grapple.png,Mith grapple
2072,A mithril grapple tipped bolt - needs a rope.,9418,True,19.0,11000.0,48,28.0,Mith grapple (unf).png,Mith grapple (unf)
2073,A mithril grapple tip.,9416,True,12.0,11000.0,30,18.0,Mith grapple tip.png,Mith grapple tip
2074,A two handed sword.,1315,False,1040.0,125.0,2600,1560.0,Mithril 2h sword.png,Mithril 2h sword
2075,Arrows with mithril heads.,888,False,12.0,7000.0,32,19.0,Mithril arrow 5.png,Mithril arrow
2076,Venomous-looking arrows.,889,True,12.0,7000.0,32,19.0,Mithril arrow(p) 5.png,Mithril arrow(p)
2077,Venomous-looking arrows.,5619,True,12.0,7000.0,32,19.0,Mithril arrow(p+) 5.png,Mithril arrow(p+)
2078,Venomous-looking arrows.,5625,True,12.0,7000.0,32,19.0,Mithril arrow(p++) 5.png,Mithril arrow(p++)
2079,I can make some arrows with these.,42,True,6.0,10000.0,16,9.0,Mithril arrowtips.png,Mithril arrowtips
2080,A powerful axe.,1355,False,208.0,40.0,520,312.0,Mithril axe.png,Mithril axe
2081,It's a bar of mithril.,2359,False,120.0,10000.0,300,180.0,Mithril bar.png,Mithril bar
2082,A vicious looking axe.,1369,False,676.0,125.0,1690,1014.0,Mithril battleaxe.png,Mithril battleaxe
2083,Mithril crossbow bolts.,9142,True,8.0,7000.0,20,12.0,Mithril bolts 5.png,Mithril bolts
2084,Some poisoned mithril bolts.,9289,True,8.0,11000.0,20,12.0,Mithril bolts (p) 5.png,Mithril bolts (p)
2085,Some poisoned mithril bolts.,9296,True,8.0,11000.0,20,12.0,Mithril bolts (p+) 5.png,Mithril bolts (p+)
2086,Super poisoned mithril bolts.,9303,True,8.0,11000.0,20,12.0,Mithril bolts (p++) 5.png,Mithril bolts (p++)
2087,Unfeathered mithril crossbow bolts.,9379,True,1.0,13000.0,1,1.0,Mithril bolts (unf) 5.png,Mithril bolts (unf)
2088,These will protect my feet.,4127,True,312.0,125.0,780,468.0,Mithril boots.png,Mithril boots
2089,Blunt mithril arrow... ouch.,4793,True,20.0,11000.0,50,30.0,Mithril brutal 5.png,Mithril brutal
2090,A series of connected metal rings.,1109,False,780.0,125.0,1950,1170.0,Mithril chainbody.png,Mithril chainbody
2091,A set of fighting claws.,3099,True,190.0,125.0,475,285.0,Mithril claws.png,Mithril claws
2092,A mithril crossbow.,9181,True,313.0,125.0,783,469.0,Mithril crossbow.png,Mithril crossbow
2093,An unstrung mithril crossbow.,9461,True,300.0,10000.0,750,450.0,Mithril crossbow (u).png,Mithril crossbow (u)
2094,A dangerous dagger.,1209,False,130.0,125.0,325,195.0,Mithril dagger.png,Mithril dagger
2095,A poisoned Mithril dagger.,1225,True,130.0,125.0,325,195.0,Mithril dagger(p).png,Mithril dagger(p)
2096,A poisoned Mithril dagger.,5674,True,130.0,125.0,325,195.0,Mithril dagger(p+).png,Mithril dagger(p+)
2097,A poisoned Mithril dagger.,5692,True,130.0,125.0,325,195.0,Mithril dagger(p++).png,Mithril dagger(p++)
2098,A deadly throwing dart with a mithril tip.,809,True,10.0,7000.0,25,15.0,Mithril dart.png,Mithril dart
2099,A deadly looking dart tip made of mithril - needs feathers for flight.,822,True,4.0,20000.0,12,7.0,Mithril dart tip.png,Mithril dart tip
2100,A deadly poisoned dart with a mithril tip.,815,True,10.0,7000.0,25,15.0,Mithril dart(p).png,Mithril dart(p)
2101,A deadly poisoned dart with a mithril tip.,5632,True,10.0,7000.0,25,15.0,Mithril dart(p+).png,Mithril dart(p+)
2102,A deadly poisoned dart with a mithril tip.,5639,True,10.0,7000.0,25,15.0,Mithril dart(p++).png,Mithril dart(p++)
2103,Do I look scary?,12369,True,4000.0,4.0,10000,6000.0,Mithril dragon mask.png,Mithril dragon mask
2104,A full face helmet.,1159,False,572.0,125.0,1430,858.0,Mithril full helm.png,Mithril full helm
2105,Mithril full helm with gold trim.,12283,False,572.0,8.0,1430,858.0,Mithril full helm (g).png,Mithril full helm (g)
2106,Mithril full helm with trim.,12293,False,572.0,8.0,1430,858.0,Mithril full helm (t).png,Mithril full helm (t)
